### ISSUE TITLE
NetherNet LAN worlds are not listed on Linux (1.26.5x): discovery broadcast is answered by the host, launcher does not react

### ISSUE THREAD

**Issue by flatiron23** [minecraft-linux/mcpelauncher-manifest#2041]
**Describe the bug**

Since Bedrock 1.26.51 the LAN transport is NetherNet only (Bedrock Dedicated Server
1.26.51.1 no longer supports RakNet). A world hosted on the local network with the
`nethernet` transport does not appear in the launcher's Friends / LAN tab, so it cannot be
joined.

A packet capture on the client shows the launcher does send NetherNet discovery broadcasts
and the hosts do answer — but nothing follows. No further packet is sent towards the
answering host, and the world never shows up in the list. A RakNet world on the same
network, on the other hand, is discovered and listed normally by the same launcher run.

An Android client (Play Store 1.26.51) on the same network lists and joins the very same
NetherNet worlds without any problem, which rules out the host side.

This may be related to #963, where the launcher used the wrong local network adapter
address for WebRTC on macOS hosts; a comment there (2024-05-22, Ubuntu 22, joining a LAN
game hosted on an Xbox) described the same direction on Linux, but it was never tracked
separately. I cannot confirm that cause from the outside — all I can show is that the
response arrives and the launcher does not act on it.

**To Reproduce**

1. Host a world on the local network with NetherNet (Bedrock Dedicated Server 1.26.51.1,
   `nethernet` transport).
2. Start the launcher (v1.8.4, flatpak) with Minecraft 1.26.51.1.
3. Open the Friends / LAN tab.
4. The NetherNet world is not listed. A RakNet world on the same network is listed.

**Expected behavior**

The NetherNet world is listed and can be joined, as it is from an Android client on the
same network.

**Desktop (please complete the following information):**

 - OS: CachyOS Linux, kernel 7.2.6-1-cachyos, x86_64
 - Version: v1.8.4 (Flathub, commit `ce7913847af37bfba2b8c419148c3e574e5116bd`)
 - Installation Type: flatpak (Flathub `io.mrarm.mcpelauncher`)

**Additional context**

Same subnet (192.168.178.0/24), no firewall between the machines. Client is
`192.168.178.165` (Wi-Fi). Three worlds are hosted on the same physical machine, each on
its own macvlan address: `.240` RakNet, `.241` and `.242` NetherNet.

`tcpdump -ni wlan0 'udp port 7551 or udp port 19132'` while the Friends / LAN tab was open
(12 seconds, abridged — the pattern repeats every 2 s):

```
15:30:28.616089 IP 192.168.178.165.7551 > 255.255.255.255.7551: UDP, length 64
15:30:28.626550 IP 192.168.178.242.7551 > 192.168.178.165.7551: UDP, length 176
15:30:28.626550 IP 192.168.178.241.7551 > 192.168.178.165.7551: UDP, length 192
15:30:29.680880 IP 192.168.178.165.59716 > 192.168.178.242.19132: UDP, length 33
15:30:29.691203 IP 192.168.178.240.19132 > 192.168.178.165.33306: UDP, length 129
15:30:30.617556 IP 192.168.178.165.7551 > 192.168.178.255.7551: UDP, length 64
15:30:30.631161 IP 192.168.178.242.7551 > 192.168.178.165.7551: UDP, length 176
15:30:30.631162 IP 192.168.178.241.7551 > 192.168.178.165.7551: UDP, length 192
```

Summary of the capture:

- The launcher broadcasts on UDP 7551 (64 bytes) every 2 s, to `255.255.255.255` first and
  to the subnet broadcast address afterwards.
- Both NetherNet hosts answer every single time (`.242` 176 bytes, `.241` 192 bytes, 7
  requests / 7 answers each).
- **The client never sends anything back to those hosts on 7551.** No unicast follow-up, no
  signaling attempt.
- In the same capture the launcher probes RakNet on 19132; `.240` answers (129 bytes) and
  that world *is* listed in the Friends / LAN tab.

So the discovery response reaches the client machine, and the launcher appears to ignore it.

The client has several non-routable bridge interfaces (Docker) besides the Wi-Fi adapter
that carries the LAN traffic — mentioning it in case the launcher picks the first local
address it finds:

```
lo               UNKNOWN        127.0.0.1/8 ::1/128
enp196s0f0u2u3   DOWN
wlan0            UP             192.168.178.165/24
docker0          DOWN           172.17.0.1/16
br-3a28a8850f87  UP             172.18.0.1/16
docker_gwbridge  UP             172.19.0.1/16
veth*@if*        UP             (several, link-local only)
```

I tried to attach a WebRTC debug log via `mcpelauncher-client -drtc`, but the client does
not start when invoked directly (outside the UI) in the flatpak build:

```
Error [MinecraftUtils] Failed to load Minecraft: dlopen failed: cannot locate symbol
"pthread_sigmask" referenced by ".../versions/1.26.51.1/lib/x86_64/libminecraftpe.so"
Signal 11 received
program failed with unix signal number: 11
```

Started from the UI the game runs fine, but then its output does not reach the terminal,
the journal or any log file I could find. If there is a supported way to get a `-drtc` log
out of the flatpak build, I am happy to provide one.
